preferred_canonical	merged_from	before_daf_count	after_daf_count
Abaye	Abbaye	533	556
Abaye and Rabbah	Abaye and Rabba	2	4
Abba Chilkiyahu	Abba Chilkiya	1	2
Abba Shaul ben Ima Miriam	Abba Shaul ben Botnit	2	3
Absorption (beli'ah)	Absorption (belu'a); Absorption (havla'ah)	1	3
Aburah (barrel)	Abussa (trough)	1	2
Accidental Homicide and Exile	Accidental Killer and Cities of Refuge	1	2
Acharav (sequential distribution)	Acharav (after him)	1	2
Achariyut (responsibility)	Achariyus (liens)	1	2
Acharonim (later authorities)	Acheirim (other sages)	1	2
Achashverosh	Achashverosh using vessels of Temple; Achashverosh vs. Ben Netzer; Achashverosh's miscalculation	3	6
Acherim Omrim (others say)	Acheirim fixed calendar opinion	1	2
Achila V'Haktarah (eating and burning)	Achilah v'Haktarah (eating and burning)	1	2
Achila v'Shtiya (eating and drinking)	Achalta V'Savata (eating and drinking)	1	2
Achilas Keva (fixed meal in Sukkah)	Achilat Keva (fixed meal)	1	2
Achim Ba'im Chavah Lah (other things come with obligation)	Achim V'Shutafim (brothers and partners)	1	2
Achitofel	Achitophel	5	7
Achitofel's Deathbed Command	Achitophel and Batsheva Genealogy	1	2
Achot (sister)	Achot Ha-Av (father's sister); Achot Ha-Em (mother's sister); Achot Isha (wife's sister)	1	20
Achot Zekuka (sister-in-law with zika)	Achot Zekuka (sister of one to whom there is zika)	1	2
Achrayus (liability/warranty)	Achrayus Ta'us Sofer (liens from scribe error); Achraiyut (responsibility); Achrayut (liability/warranty)	13	27
Achsadra (portico)	Achsadra (portico) in exemption	5	6
Achsanya (guest)	Achsanai (guests); Achsanaim (guests); Achsannai (guest obligation)	1	4
Achuza (portion of land)	Achuzat Nachalah (possession of inheritance)	1	2
Adam Chashuv (honorable person)	Adam Chashuv (important/wealthy person)	8	9
Adam HaRishon (first man)	Adam HaRishon and fire; Adam HaRishon and the gift of wisdom; Adam HaRishon and the winter solstice; Adam HaRishon naming creatures; Adam HaRishon's Korban (first offering)	8	13
Adamah Asur Natata Li (the land that you gave me)	Adama She'Nasata Li (land you gave me)	0	1
Adar Rishon (first Adar)	Adar Rishon vs. Adar Sheni	1	2
Adat Korach (Korah's congregation)	Adat Korach (congregation of Korach)	2	6
Admission (Hodaah)	Admission (Modeh)	2	3
Admon and Chanan ben Avishalom	Admon's argument	1	2
Adrachta (power of attorney)	Adrachta (seizure authorization)	1	2
Adultery	Adultery (noef/noafet); Adultery (zenut)	1	3
Afar (ashes)	Afar (ashes/dust); Afar (dirt)	1	4
Afikoman (final piece of matzah)	Afikoman (conclusion of Passover meal)	6	7
Afsana (halter)	Afsar (halter)	1	2
Agada (homiletic teaching)	Aggadah (non-legal teaching)	5	7
Agalah (wagon)	Agala (baby carriage)	1	2
Agav (because of)	Agav (accompanying transfer through land acquisition)	1	2
Age of puberty	Age of physical maturity	1	2
Aggadic Exegesis	Aggadah interpretation methods	1	2
Agud (binding of lulav)	Aggud (binding)	1	2
Agudah (bundle)	Agudah (bundle of documents)	2	3
Agunah (chained woman)	Agunot (chained women)	33	34
Ahava (love of God)	Ahavat Hashem (love of God)	1	2
Ahava rabba (great love)	Ahava rabba and ahavat olam	2	4
Ahavat re'acha kamocha (love your neighbor as yourself)	Ahavta le're'acha kamocha (love your neighbor as yourself)	1	3
Ailonit (infertile woman)	Ailonit (barren woman)	6	10
Akarah (infertile woman)	Akar (sterility or infertility); Akara Hilchatit (halakhically barren); Akarot (barrenness or damage)	2	5
Akedat Yitzchak (Binding of Isaac)	Akedat Yitzchak in Rosh Hashanah (Binding of Isaac in Rosh Hashanah)	8	9
Akira and Hanacha (lifting and putting down)	Akirah v'hanachah (lifting and placing down); Akira Tzorech Hanachah (lifting is necessary for putting down)	4	6
Akum (non-Jew)	Akum (idolatry)	2	3
Al Da'as (on presumption or consent of)	Al Da'at (with understanding of); Al da'at ishto u'vanav (with the understanding regarding his wife and children); Al da'at rabbim (with the understanding of the public)	1	4
Al ha'aretz (on the land)	Al ha'aretz (upon the earth)	1	2
Al Menat (on condition that)	Al Menat Ken (with that condition); Al menat she-eifra mimi she-ertzeh (conditional stipulation for collection); Al menat sheykablum li (on condition that they accept for me)	0	3
Al pi atzmo (by own admission)	Al Pi Atzmo (by own admission)	1	2
Alaw (ligament or muscle of neck)	Alal (meat left on hide)	1	2
Alef-bet (Hebrew alphabet)	Aleph-bet drasha (midrash on letter meanings)	1	2
Aleha (upon her; links to yibum)	Aleha (upon her)	1	2
Aliyah (upper chamber)	Aliya (upper chamber); Aliya (upper room for rabbinic meetings); Aliya (upper story); Aliyah (upper story); Aliyot (upper levels)	1	6
Aliyah in the synagogue (Torah honor)	Aliyah (Torah honor in reading)	1	2
Aliyah l'regel (pilgrimage to the Temple)	Aliyah L'Regel (pilgrimage)	4	5
Aliyot (Torah honors)	Aliya (best property; full damages from owner's assets)	1	2
All-or-nothing principle (stam vow must be wholly annulled)	All-or-nothing principle	1	4
Almanah (widow)	Alma (widow in yibum context); Almana (widow); Almana (widow; widow's support rights); Almono (widow)	13	26
Almanah and Gerushah (widow and divorcee)	Almana/Gerushah (widow/divorcée); Almanah and Betulah (widow and virgin marriage laws)	1	3
Almanah to Kohen Gadol (widow to high priest)	Almana to Kohen Gadol (widow to High Priest)	2	4
Am Ha'aretz (unlearned person)	Am Ha'aretz (common person)	28	31
Amad ba-din (court judgment)	Amad B'Din (court judgment)	1	2
Amah (cubit)	Amah Beinonis (standard cubit); Amah Chamisha Tefach (small cubit); Amah Shel Kodesh (standard cubit)	9	12
Amah Ivriyah (Jewish slave woman)	Amah Ivriyah (Hebrew maidservant)	1	11
Amatai (when; clarification vs. disagreement)	Amatla (explanation or nullification)	1	2
Amei Ha'aretz vs. Chaveirim (common people vs. careful observers)	Amei Ha'aretz (common people)	1	5
Ameimar vs. Rav Ashi on release authority and courts	Ameimar vs. Resh Lakish and Rabbi Yochanan on acquisition	1	2
Amen response	Amen in oath acceptance; Amen Amen (double affirmation)	3	5
Amira L'Akum (instructing a non-Jew)	Amira L'Goy (instructing a non-Jew)	2	11
Ammonites and Moabites	Ammonite and Moabite; Ammon and Moab; Ammon and Moab in tithes and shemita	1	6
Amoni and Moavi conversion and community inclusion	Amoni (Ammonite)	1	2
Amoraim (rabbinic debaters)	Amora (announcer in study hall); Amoraim (announcers); Amoraim (speakers in yeshiva)	1	4
Amud (page side)	Amud Bet (page side b)	1	2
Amulets (Kamea)	Amulets; Amulets (Kamea) and Divine Names	3	5
Anal intercourse and Bi'ah status	Anal intercourse	1	2
Aneinu (fast-day prayer)	Aneinu (answer us prayer)	1	3
Angarya (forced seizure)	Angarya Hozeret (recurring forced labor); Angarya She'eino Hozeret (non-recurring forced labor)	1	3
Anigron (medicinal oil mixture)	Anigron (wine-steeped vegetables)	1	2
Aninus (mourning status)	Aninut (acute mourning state)	7	8
Apotropos (guardian; trustee)	Apotropus (court-appointed guardian)	15	17
Arava (willow branch)	Aravot (willows)	7	8
Arayos (forbidden sexual relations)	Arayos (sexual relations prohibited by Torah); Arayot (forbidden relations)	1	31
Arba Minim (four species)	Arba Minim (four kinds); Arba Minim (four species on Sukkot)	1	7
Arbaim Yakenu (forty lashes)	Arbaim Chasar Achat (forty minus one)	1	2
Arei Miklat (cities of refuge)	Arei Leviyim (Levite cities)	8	10
Areiv (guarantor)	Arev (guarantor); Arevut (guarantor)	8	16
Arel Basar (uncircumcised flesh)	Arla (foreskin) as identity marker	1	2
Arifah (breaking the neck of the heifer)	Arifah (wringing the neck); Arifat Egla Arufa (breaking the heifer's neck)	0	4
Arkuba (knee)	Arkov (knee joint)	2	3
Aron (ark)	Aron HaKodesh (holy ark)	17	18
Aron HaBrit (ark of covenant)	Aron and Holy Vessels (ark and vessels); Aron and Its Fate (ark and its fate); Aron and Kapores (ark and mercy seat); Aron HaBrit and Dedication (ark and dedication)	1	5
Aroyos (forbidden sexual relationships)	Arayot (sexual misconduct)	1	2
Arusa (betrothed woman)	Arusa (betrothed wife)	16	17
Arusin (betrothal)	Arusin (betrothed)	1	2
Aseres HaDibros (Ten Commandments)	Aseret Hadibrot (Ten Commandments)	4	5
Asham Metzora (guilt offering for leper)	Asham Metzora (guilt offering of leper)	2	8
Asherah (tree dedicated to idolatry)	Asherah wood (tree dedicated to idolatry)	15	17
Ashes (efer)	Ashes (efer vs. afar)	0	1
Ashir (wealth)	Ashirut (wealth)	1	2
Ashir (wealthy person)	Ashirin Mekamtzin (rich people are stingy)	2	3
Ashkenazi (Franco-German Jewry)	Ashkenaz (Franco-German Jewry); Ashkenazi Jews	2	4
Ashkenazi Custom (practice)	Ashkenazi Tradition	5	6
Ashmachta (unenforceable conditional promise)	Asmachta (textual support for rabbinic law); Asmachta (unenforceable conditional promise)	0	39
Ashpa (garbage dump)	Ashpah (trash pile) and Pinui (removal); Ashpato (garbage heap)	1	3
Assei (positive commandments)	Asseh (positive commandment that does not invalidate)	1	2
Assur (forbidden)	Assur (bound; tied)	9	10
Assur L'Kana (forbidden to be jealous)	Assur Lekanot (forbidden to be jealous)	1	2
Atara (crown)	Atara (corona of the penis)	2	4
Atifat HaRosh (head veiling)	Atifat HaRosh (head wrapping)	1	2
Atonement (Kappara)	Atonement in Kappara (Atonement for Kohanim vs. Israel)	1	2
Atzeret	Atzeres (holy convocation)	1	3
Atzitz Nakuv (perforated pot)	Atiz Nakuv (flowerpot with hole); Atzitz Nakuv (flowerpot with hole)	1	6
Av and Tolada (primary and derivative categories)	Av and Tolada categories	1	2
Av HaTumah (primary source of impurity)	Av HaTumah and Rishon impurity levels	14	15
Av Melachah and Tolada Melachah	Av Melachah (primary forbidden labor on Shabbat)	1	2
Avak Ribbit (dust of interest)	Avak Ribit (dust of interest)	3	4
Aveilus (mourning laws)	Aveilus (mourning)	1	18
Aveira (sin/transgression)	Aveira (transgression)	1	8
Avel (mourner)	Avel in mourning (mourner obligations)	3	5
Avelut (mourning)	Avelut in Shabbat (mourning on Shabbat)	3	4
Avida (lost item)	Avida (lost animal)	1	2
Aviv (ripened grain)	Aviv (ripening grain)	3	5
Avnet (priestly belt)	Avnet (belt)	2	3
Avodah (Temple service)	Avoda (service)	29	32
Avodah Zara (idolatry)	Avodah Zarah (idolatry); Avodat Kochavim (idolatry)	4	101
Avodas Pnim (worship in the Temple)	Avoda tama (defiled service)	1	2
Avon (willful sin)	Avon (iniquity)	1	3
Avot (patriarchs)	Avot (forefathers)	1	2
Avot V'Toldot (primary and secondary categories)	Avot vs. Korbanot Model	1	2
Avuda (lost status)	Avud (lost)	2	5
Aylonit (woman incapable of bearing children)	Ayalonit (infertile woman)	3	7
Azarah (Temple courtyard)	Azara (Temple courtyard); Azarot (Temple courtyards)	33	35
Azharah (warning)	Azharah (warning) and Onsh (punishment)	3	4
Ba'al HaBayit (homeowner)	Ba'al habayit (employer/homeowner); Baal Habayit (homeowner)	14	17
Ba'al Keri (seminal emission)	Baal Keri (man with seminal emission)	20	23
Ba'al Korchah (against her will)	Baal Karchah (without consent)	3	4
Ba'al Mum (blemished)	Ba'al mum (blemished animal); Baal Mum (blemished animal)	10	27
Ba'al Peor	Baal Peor	1	4
Ba'al Teshuvah (repentant person)	Ba'alei Teshuvah (penitents)	3	6
Ba'alat Mum (blemished animal)	Ba'al Mum in offerings (blemished offering)	1	2
Ba'alei Mumin (blemished animals)	Ba'alei Mumim (priests with blemishes)	3	5
Babylonia vs. Eretz Yisrael (practice differences)	Babylon and Eretz Yisrael	2	3
Badika (examination)	Badikos vs. Chakirot (testimony examination)	2	3
Badim (ark staves)	Badim (poles/staves)	1	2
Baheret (discoloration in tzara'at)	Baheret, se'et, sid, and krum habeitza (four types of leprosy marks)	1	2
Baitusim (Sadducean sect)	Baitus ben Zonin	3	4
Bakar and Tzon (cattle and sheep)	Bakar VaTzon (cattle and sheep)	0	1
Bal Talin (prohibition on withholding wages)	Bal talin (do not delay payment)	4	5
Bamah (private altar)	Bamah Ketanah (private altar); Bamah Ktana (small private altar); Bamah Yachid (private altar); Bamas Yachid (private altar)	21	27
Bamah Gedolah (central public altar)	Bamah Gedola (great central altar); Bamas Tzibur (public communal altar)	2	4
Bamidbar (Book of Numbers)	Bamidbar (in the wilderness)	1	2
Banim v'lo banot (sons and not daughters)	Banecha v'lo bnosecha (sons and not daughters); Banim v'lo banot (men and not women)	0	3
Bar Mitzvah (adulthood at age thirteen)	Bar/Bat Mitzvah (age of majority)	7	10
Bar Sisan property case	Bar Sisan (property called by this name)	1	2
Baraita (Tannaitic teaching)	Baraita; Baraita (tannaitic source)	49	51
Bari v'bari (definite versus definite claims)	Bari v'bari (definite vs. definite claims); Bari ve-Bari (both parties make definite claims)	2	6
Bari v'shema (definite vs. uncertain claim)	Bari v'shma bari (strong versus doubtful claim); Bari ve-Shema (definite vs. doubtful claim); Bari vs. Shema (certainty vs. doubt)	1	11
Barkai (light signal)	Barkai formula	1	2
Basar B'Chalav (meat and milk)	Basar V'Chalav (meat and milk)	15	16
Bat Kohen (daughter of a priest)	Bat Ish Kohen (daughter of a priestly man)	22	23
Bat Kol (heavenly voice)	Bas Kol (heavenly voice); Bat kol (heavenly voice); Bat kol (heavenly voice) and righteous deaths	14	21
Bat Levi (Levite woman)	Bat Levi (daughter or wife of Levite)	1	2
Batei Avos (family houses of priests)	Batei Avos (ancestral houses); Batei Avos (father's houses)	1	3
Bathing	Bathing (rechitza)	1	3
Batim (compartments of tefillin)	Batim (houses)	1	2
Batla Daato Azel Kol Adam (abandoned by all people)	Batla Daato Etzel Kol Adam (intention negated by common practice)	1	3
Bavel (Babylon)	Bavel (Babylon) and distant lands; Bavel in context of genealogical significance; Bavel in context of omens; Bavel in relation to Eretz Yisrael; Bavel vs. Eretz Yisrael	11	20
Bayit (house)	Bayit (house) and absorbed fluids; Bayit (house) and wife equivalence; Bayit (house) as dwelling; Bayit (house) definition; Bayit (house) exemption in inauguration; Bayit (house) vs. Har (mountain) vs. Sadeh (field); Bayit k'man d'malya (house as resting place); Bayit Mekurah (roofed house)	5	13
Bayit HaMikdash (Temple)	Bayit Rishon (First Temple); Bayit Sheni (Second Temple)	2	7
Bayom (during the day)	Bayom (on that day); Bayom (on the day)	1	3
Be'chayim u'vemavet (in life and in death)	Be'chayai u'vemoti (in my life and in my death)	1	2
Be'ein (the actual object)	Be'ein (in its own form)	1	2
Be'itah achishena (in its time, hasten it)	Be'itah (kicking)	1	2
Be'ulah (woman who has had sexual intercourse)	Be'ulah (non-virgin woman)	1	3
Bechor (firstborn)	Bechor (firstborn animal offering); Bechor (firstborn animal); Bechor (firstborn son)	45	100
Bechor Behema (firstborn animal)	Bechor Behemah Tehorah (firstborn kosher animal)	1	2
Bedek HaBayit (Temple maintenance fund)	Bedek habayit (temple treasury)	21	22
Bedi'avad (after the fact)	Bedieved (post-facto acceptance); Bedieved (post-facto leniency); Bedieved (post-facto validity)	20	23
Bedi'avad vs. Lechatchila	Bedieved vs. Lechat	2	3
Bedika (examination)	Bedika (checking the knife); Bedika (checking with cloth); Bedika (checking); Bedika (examination cloth); Bedika (examination of facts); Bedika (internal checking); Bedika (internal examination); Bedika (internal organ checking); Bedika (investigation of facts); Bedika (testing)	4	21
Befanai nechtav uvfanai nechtam (written and signed before witnesses)	Befanai nechtav (written before witnesses)	3	4
Beged ish u-beged isha (men's and women's garments)	Beged ish (men's garment); Beged isha (women's garment)	1	3
Behemah (domestic animal)	Behemah (animal); Behemah Bayit (domestic animal)	22	24
Behemah dakah (small animal)	Behemah Dakah (small animals)	3	5
Behemah gasah (large animal)	Behemah Gasah (large animals)	3	5
Behemah Teme'ah (non-kosher animal)	Behemah temeia (non-kosher animal)	3	4
Beheret (bright spot)	Beheret (snow-white color)	1	2
Beis Din (Jewish court)	Beis Din shel Yisrael (Jewish court)	27	28
Beis Din HaGadol (High Court)	Beis Din of seventy-one	5	7
Beis HaAvel (mourners' space)	Beis Avel (house of mourning)	1	3
Beis HaDeshen (ash pit)	Beis Hadeshen (ash house)	1	3
Beis HaMidrash (study hall)	Beis Medrash (study hall)	1	2
Beis Hillel	Beis Hillel and Beis Shammai dispute	7	34
Beis Kvoros (cemetery)	Beis HaKevaros (cemetery)	1	2
Beis Shammai	Beis Shammai vs. Beis Hillel	7	21
Beit Abtinas	Beit Abtinas and Ketoret Monopoly	1	2
Beit Av (daily priestly group)	Beis Av (priestly subdivision)	3	4
Beit Chalifot (knife storage chamber)	Beit Chalipot	1	2
Beit Chonyo (temple in Alexandria)	Beit Chonyo (Temple of Chonyo)	1	2
Beit Din (court of law)	Beit Din (Jewish court)	1	51
Beit Din authority and jurisdiction	Beit Din authority and psak	1	2
Beit Din Ha-Gadol (Great Sanhedrin)	Beit Din of Seventy-One	6	7
Beit Din of Three	Beit Din in three judges	1	2
Beit Din of three vs. ten	Beit Din in five judges	1	2
Beit Dira (domicile)	Beit Dirah (dwelling)	4	5
Beit Ha-Kiseh (toilet)	Beit Kisei (bathroom)	2	3
Beit Ha-Kneset (synagogue)	Beit Knesset (synagogue)	3	6
Beit Ha-Midrash (house of study)	Beit Medrash (study hall)	1	9
Beit Ha-Mikdash (Holy Temple)	Beit HaMikdash (Temple)	62	63
Beit HaPras (field with unknown grave)	Beit Ha-Peras (plowed cemetery field)	1	10
Beit Kibbul (receptacle criterion for vessels)	Beit Kibul (receptacle)	1	4
Beit Kor (land measure)	Beit kor (measure of field area)	6	7
Beit Mitbachaya (slaughterhouse)	Beit Midbachaya (altar area)	1	2
Beit satayim (two seahs measure)	Beit Satayim (area measure)	1	8
Beit Se'ah (land measure)	Beit se'ah (standard area)	1	2
Beit sha'ar (gatehouse)	Beit Sha'ar (gatehouse); Beit shaar (gatehouse)	0	5
Beitzah (egg-sized measure)	Beitza (egg measure)	4	6
Belila (mixing with oil)	Belila Raka (loose mixture)	3	4
Belula (mixed)	Belula (mixed together); Beluah (mixed)	1	3
Bemezid (intentional)	Bemeizid (willful sin)	2	3
Ben Bechor and Chelek Bechorah (firstborn portion)	Bekhor (firstborn) double portion	1	2
Ben Bukhri Testimony	Ben Bukhri vs. Rabban Yochanan ben Zakkai	1	2
Ben Gazlan (son of thief)	Ben Ben Gazlan (grandson of thief)	1	2
Ben Gerusha and Ben Chalutzah (son of divorcee or widow from levirate non-marriage)	Ben Gerusha (son of divorcee)	6	7
Ben Katina	Ben Katin	0	2
Ben Kodem Le-Bat in inheritance (son inherits before daughter)	Ben Kodem Le-Bat (son inherits before daughter)	1	2
Ben Nannas in contradictory oaths (second clause nullifies first)	Ben Nannas	1	11
Ben Shanah (one year old)	Ben Shana (lamb-wine analogy)	1	2
Ben Shmona (eight-month infant)	Ben Shemonah	1	2
Ben Yomo (within 24 hours)	Ben Yom Echad (one-day-old infant)	3	4
Benaiah ben Jehoiada	Benayahu ben Yehoyada	1	5
Benei Torah (educated scholars)	Beni Torah vs. Non-Beni Torah	1	2
Benjamin (tribe and descendants)	Benjamin	1	3
Beraita (tannaitic teaching not in Mishnah)	Beraita (Tannaitic teaching outside Mishnah)	5	7
Berakhah (blessing)	Berakhot (blessings)	3	4
Bereira (retroactive clarification)	Bereira (retroactive determination)	2	6
Beriyas Olam (creation of world)	Bereishit narratives in creation	1	2
Besamim in Havdalah	Besamim (spices)	1	2
Besis (base supporting object)	Besis (base supporting muktzah object)	5	6
Bestiality (absolute disqualification)	Bestiality; Bestiality concerns	1	4
Besulah (virgin)	Besulah (pre-menarche woman)	5	6
Besulim (virginity)	Besulim (hymen)	1	2
Bet Hillel and Bet Shammai	Bet Shammai vs. Bet Hillel in Sukkah	1	2
Betulah (virgin)	Betula (virgin; hymen intact); Betula (virgin; young girl who has not menstruated); Betulah (virgin) in wedding on Wednesday; Betulah (virgin; young girl)	7	11
Betulah (virgin) vs. Almanah (widow)	Betulah and almanah	1	2
Betulah/Virginity	Betulim (virginity); Betulot/Virginity analogy	1	3
Betzalel and the Mishkan	Betzalel; Betzalel in construction of the Aron	1	4
Betzelem Elohim (divine image)	Betzelem Elokim (in image of God)	1	2
Beulah (non-virgin)	Beulah (non-virgin) / Bogeret (mature woman)	1	2
Bevas achat (all at once)	Bevat achat (all at once)	1	2
Beyado (within one's power)	Beyada (in one's control; domain); Beyado (within one's power; ability)	1	3
Bi'ah (sexual intercourse)	Bi'ah (full intercourse); Bi'ah (intercourse); Bi'ah (sexual union; intercourse)	1	5
Bi'ur (removal; destruction of Shemita produce)	Bi'ur (destruction obligation of Shemittah produce); Bi'ur (destruction; removal of Sabbatical produce); Bi'ur (removal obligation); Bi'ur (removal; burning)	1	5
Bi'ur chametz (destroying chametz)	Bi'ur chametz	1	2
Biah (sexual intercourse)	Bia (sexual relations); Bia (sexual union as mode of Kiddushin); Biah (act of intercourse); Biah (consummation; sexual union); Biah (intercourse; cohabitation); Biah (sexual intercourse; consummation); Biah (sexual relations)	1	10
Biah be-miktzat (partial intercourse)	Bia'ah be-miktzat (partial entry); Bia bimiktzat (entry with body part)	1	3
Biah pesulah (invalid; problematic consummation)	Biah pesulah (invalid act of union)	1	2
Biat zenut (forbidden intercourse)	Biat zenut (relations without marriage protections); Bi'as zenus (marital relations as fornication)	1	3
Biblical vs. Rabbinic Law (d'oraita vs. derabbanan)	Biblical (d'oraita) vs. Rabbinic (d'rabanans); Biblical obligation vs. rabbinic obligation; Biblical vs. Rabbinic Concerns; Biblical vs. Rabbinic Obligations	3	8
Bifanai Nichtav (written before witnesses)	Bifanai Nechtav (written before witnesses); Bifanai Nichtav U'Bifanai Nechtam (written and signed before witnesses)	2	16
Bigdei Kehunah (priestly garments)	Bigdei Kehuna (priestly garments); Bigdei Kehunah (priestly garments) comparison	16	18
Bikkurim (first fruits)	Bikurim (first fruits); Bikkurim in Human Activity	27	29
Bimah (pulpit)	Bimah (platform); Bimus (platform/stone)	1	3
Binah (understanding/wisdom)	Binah in salt metaphor (wisdom metaphor)	1	2
Birah (temple/castle)	Bira (capital/temple fortress); Birah (castle; multiple separate dwellings); Birah (central place worthy of sanctity)	1	4
Birkat HaMazon (grace after meals)	Birkat Hamazon (blessing after meals)	18	20
Birkat HaMitzvot (blessings on commandments)	Birkat HaMitzvah (blessing on performance of commandment)	1	2
Birkat HaNehenin (blessing before consuming)	Birkat Hanehenin (blessing for benefit)	2	3
Birkat Hashanim (blessing of years/sustenance)	Birkat Hashanim (blessing of the years)	1	2
Birkat HaShevach (blessing of praise)	Birkat Hashevach (blessing of praise)	3	4
Birkat HaTorah (blessing on Torah)	Birkat HaTorah (blessing over Torah)	1	4
Birkat Kohanim (priestly blessing)	Birkat kohanim (priestly blessing)	8	9
Bishul (cooking)	Bishul on Shabbat (cooking on Shabbat)	12	14
Bitel (nullification)	Bittul (nullification); Bitul (nullification)	4	50
Bittul b'rov (nullification by majority)	Bitul be-Rov (nullification in majority)	1	2
Bittul Beit HaMidrash (cessation of study hall)	Bittal Beit Midrash (interruption of study)	1	2
Bittul of idolatry (nullification of idol)	Bitul Avodah Zarah (nullification of idol); Bittul avodah zara (nullification of idol worship)	2	5
Bitul Torah (neglect of Torah study)	Bitul Torah (wasting time from Torah study)	2	3
Bizayon (disgrace)	Bizayon (disrespect)	1	5
Bizui Kodashim (disrespect to sacred objects)	Bizayon Kodshim (degradation of sacred objects)	1	3
Blemished animals (ba'al mum)	Blemishes on body (mumim she'baguf)	2	3
Blind in one eye (suma b'achat mei'einav)	Blind in one eye: physical defects and exemptions	1	2
Blood application (hazaah)	Blood application	1	2
Blood application on altar	Blood application requirements (zrikat hadam)	1	2
Blood spurting (zinkat dam)	Blood squirting (zeniqat dam)	1	2
Bloodletting (hakazah)	Bloodletting (hakazat dam); Bloodletting (hakiz dam); Bloodletting (hekiz dam)	1	4
Bnei Chorin (free persons)	Bnei chorin (unencumbered property)	1	2
Bnei Noach (Noahide laws)	Bnei Noach (Jews vs. non-Jews)	14	15
Bo'el niddah (one who has relations during menstruation)	Boel niddah (relations with menstruant)	2	4
Boat and ship terminology	Boat delivery (Sfina)	1	3
Boel (suspected adulterer)	Boel Aramit (relations with non-Jewish woman); Boel biat mitzvah u'poresh (one act then separate)	1	3
Boleshet (military forces)	Bolshet (invading army)	1	2
Boneh and soter on Shabbat	Boneh (building)	1	7
Bor (pit/cistern)	Bor (pit/well); Bor (well) exemption for vessels	27	29
Bor and dus	Bor and dos in land sale	1	2
Boreach (runaway)	Boreach (fugitive); Boreach (runaway slave)	1	3
Borei minei besamim (blessing on aromatic things)	Borei atzei besamim (blessing on aromatic woods)	1	2
Borei peri hagafen (blessing over wine)	Borei Pri Ha'adama (blessing for ground produce); Borei Pri HaGafen (blessing for wine); Borei Pri Hagafen (blessing on wine)	1	21
Borer (selecting/sorting)	Borer in Yom Tov (selecting/sorting on festival)	9	10
Boshet (embarrassment)	Boshes u'pegam (embarrassment and injury); Boshet and Pegam (embarrassment and injury compensation); Boshet Panim (shame of face)	17	23
Botzea (compromise)	Botze'a (one who breaks bread and blesses)	1	2
Bowing/Prostration	Bowing and rising in prayer	1	3
Bracha (blessing)	Brachot (blessings)	11	12
Braita (tannaitic teaching outside Mishnah)	Braita (external Talmudic source)	73	76
Breaking earthenware vessels (kli cheres)	Breaking pottery (shvirin et hacheres)	1	2
Breaking the tablets (shivrei luchot)	Broken tablets in ark	1	2
Briah (whole creature)	Briya (whole creature)	1	3
Brit Milah (circumcision)	Brit Milah on eighth day; Brit Milah on Shabbat	29	35
Brreichot (pools/collected reservoirs)	Breicha (ripening cycle/brood); Breicha Sheniyah (second brood)	0	2
Buffer zone (gudi d'arudai)	Buffer zone (darchan shel bnei adam)	1	2
Burial (kevura)	Burial and funeral practices; Burial practices and customs	1	3
Burning of fats and organs (eimurim)	Burning on mizbeach (altar)	1	2
C-section birth (yotzei dofen)	C-section animals (yotzei dofen)	2	3
Called imma (grandmother/mother)	Canaanite slaves (eved kena'ani)	1	2
Camp transit (siluk masaot)	Camp in motion (machaneh moving)	1	2
Candlelight (or haner)	Candlelight reading (keriat b'or haner)	1	2
Capital cases (dinei nefashos)	Capital crimes (dinei nefashot)	1	2
Carob tree	Carob and sycamore trees; Carobs (charuvin)	1	5
Carrying (hotza'ah)	Carrying (hotza'ah) vs. moving (tiltul)	4	5
Cedar tree	Cedar tree between trees; Cedar vs. Sycamore (roof materials)	1	3
